{
  "schema_version": 1,
  "snapshot_id": "fixture-absolute-token-balance",
  "provider_id": "openai",
  "agent_id": "codex-cli",
  "host_id": "terminal",
  "model_id": "codex-demo",
  "account_profile_id": "acct-demo-openai",
  "source_kind": "provider_api",
  "metric_kind": "token_balance",
  "unit": "token",
  "status": "available",
  "observed_at": "2026-09-10T00:00:00Z",
  "windows": [
    {
      "window_id": "token-balance",
      "label": "token balance",
      "used_units": 250,
      "remaining_units": 750,
      "limit_units": 1000,
      "unit": "token",
      "percent_used": 25,
      "percent_remaining": 75,
      "resets_at": null
    }
  ],
  "stale": false,
  "last_good_at": "2026-09-10T00:00:00Z",
  "error_code": null,
  "error_reason": null
}
